name,id,category,categoryDisplay,keywords,link,pointType,locationType,locations,latitude,longitude,mappable,address,description,notes,shortDesc
The Creative Kitchen,prj13,Education,Education,,http://www.thecreativekitchen.com/,points,Operating Locations,"[{""lat"":40.7594993, ""lon"":-73.968301}, {""lat"":40.7237875, ""lon"":-73.9945774}, {""lat"":40.6570184, ""lon"":-73.9664357}, {""lat"":40.7417101, ""lon"":-73.9976813}]",,,Y,,"The Creative Kitchen teaches children about food and how to cook in a fun, safe, and educational manner. The multi-faceted company includes a variety of media outlets which promote the curriculum. Targeting children ages two and older, the company focuses on teaching, writing, producing creative content, and consulting to present educational content through food-related activities. The founder, Cricket Azima, inspires children to express themselves creatively through cooking and the arts. While writing her master’s thesis, entitled “Children’s Cooking Classes: An Alternative Method to Enhance Learning,” Cricket learned that children retain more educational content of a lesson when using all of their senses and, of course, when having fun in the meanwhile!",,"The Creative Kitchen teaches children about food and how to cook in a fun, safe, and educational manner."
Veggication,prj18,Education,Education,,http://www.veggiecation.com/,point,HQ,,40.9803467,-74.1617939,Y,,"The mission of Veggiecation is to promote and educate communities on the health benefits of vegetables and how to prepare them in simple, unique, affordable, and most importantly, delicious ways.",,"The mission of Veggiecation is to promote and educate communities on the health benefits of vegetables and how to prepare them in simple, unique, affordable, and most importantly, delicious ways."
With Food in Mind,prj15,Education,Education,,http://www.withfoodinmind.org/,point,HQ,,40.6574034,-73.9642796,Y,,"With Food in Mind develops art-based approaches to food education and food injustice, with a focus on childhood obesity and nutrition disparities in low-income neighborhoods and communities of color. We're cultivating future generations of art enthusiasts and healthier eaters, too. Our programs inspire children and youth to look at art in new ways, make healthful food choices, and think across disciplines.",,"With Food in Mind develops art-based approaches to food education and food injustice, with a focus on childhood obesity and nutrition disparities in low-income neighborhoods and communities of color."
Food Book Fair,prj21,Events,Events,,http://www.foodbookfair.com/,point,HQ,,40.7220318,-73.9602657,Y,,"Food Book Fair launched in 2012 as the first event of its kind: part festival, part conference, set at the intersection of food culture and food systems.Dubbed the ""Coachella of writing about eating,"" ""a voracious reader's dream,"" and, simply, ""food geek heaven,"" our event remains ceaselessly inspired by food media — books, of course, but also print and online magazines, television, film and radio.Our dynamic programs include panel discussions, a pop-up bookstore, #Foodieodicals, cooking demos, conceptual literary dinners, film screenings and much more.",,"Food Book Fair launched in 2012 as the first event of its kind: part festival, part conference, set at the intersection of food culture and food systems."
Brooklyn Grange,prj25,Greenspaces,Greenspaces,,http://www.brooklyngrangefarm.com/,point,Farm,,40.7034597,-73.9739683,Y,,"Brooklyn Grange is the leading rooftop farming and intensive green roofing business in the US. We operate the world’s largest rooftop soil farms, located on two roofs in New York City, and grow over 50,000 lbs of organically-cultivated produce per year. In addition to growing and distributing fresh local vegetables and herbs, Brooklyn Grange also hosts events and educational programming, provides urban farming and green roof consulting and installation services to clients worldwide, and partners with numerous non-profit organizations throughout New York to promote healthy and strong local communities.",,Brooklyn Grange is the leading rooftop farming and intensive green roofing business in the US.
Edgemere Farm,prj22,Greenspaces,Greenspaces,,http://www.edgemerefarm.org/,point,HQ,,40.5953631,-73.7787277,Y,,"Edgemere Farm is a half-acre urban farm located in the beachside community of Far Rockaway, Queens. In 2013 its founders transformed an underutilized lot on Beach 45th Street into a lush and productive space, where a wide variety of fresh and organically grown vegetables, flowers and herbs are now cultivated. Bees, chickens and many varieties of pollinators use the farm as home base as well. The farm is a self-sustaining enterprise and acts as a zero-profit business. Profits are reinvested into the farm for future projects and operation costs. In 2015 we co-founded the East Rockaway Growing Coalition, in order to further our mission of increasing capacity for the production of food on the peninsula. To that end, we strive to be a place where we are teaching and learning about growing plants with neighbors and friends of all ages and backgrounds.",,"Edgemere Farm is a half-acre urban farm located in the beachside community of Far Rockaway, Queens."
Farm Sanctuary,prj24,Greenspaces,Greenspaces,,http://www.farmsanctuary.org/the-sanctuaries/watkins-glen-ny/,point,Farm,,42.385264,-77.0297139,Y,,"Farm Sanctuary was founded in 1986 to combat the abuses of factory farming and encourage a new awareness and understanding about farm animals. Today, Farm Sanctuary is the nation’s largest and most effective farm animal rescue and protection organization. We have rescued thousands of animals and cared for them at our sanctuaries in Watkins Glen, New York; Northern California (Orland); and the Los Angeles area. At Farm Sanctuary, these animals are our friends, not our food. We educate millions of people about their plight and the effects of factory farming on our health and environment. We advocate for laws and policies to prevent suffering and promote compassion, and we reach out to legislators and businesses to bring about institutional reforms.Farm Sanctuary is committed to ending cruelty to farm animals and promoting compassionate vegan living through rescue, education, and advocacy efforts. Please join us. A compassionate world begins with you!",,Farm Sanctuary was founded in 1986 to combat the abuses of factory farming and encourage a new awareness and understanding about farm animals.
Sure We Can,prj23,Greenspaces,Greenspaces,,http://www.surewecan.org/,point,Storefront,,40.7054817,-73.9404633,Y,,"Sure We Can is a non-profit recycling center, community space and sustainability hub in Brooklyn where canners, students and neighbors come together through recycling, composting, gardening, art and other initiatives. Our mission is to support the local community, particularly the most vulnerable residents, and promote social inclusion, environmental awareness and economic empowerment.For over 9 years, Sure We Can has supported canners, who are people that make a living collecting cans and bottles from the streets and redeeming them for 5 cents each. Today, it has evolved into a community center that promotes a sustainable urban culture and facilitates a circular economy.",,"Sure We Can is a non-profit recycling center, community space and sustainability hub in Brooklyn where canners, students and neighbors come together through recycling, composting, gardening, art and other initiatives."
Agrilicious,prj27,Guides,Guides,,http://www.agrilicious.org/,N/A,,,,,N,,"A First-of-its-Kind National Destination and Marketplace - Agrilicious is the go-to source for all things local food. Its mission is to expand the family-farmer connection, while celebrating the food experiences and the benefits this brings about.",,"A First-of-its-Kind National Destination and Marketplace - Agrilicious is the go-to source for all things local food. Its mission is to expand the family-farmer connection, while celebrating the food experiences and the benefits this brings about."
Eat Well Guide,prj26,Guides,Guides,,http://www.eatwellguide.org/,N/A,,,,,N,,"The Eat Well Guide® is a curated directory of over 25,000 hand-picked restaurants, farms, markets and other sources of local, sustainable food throughout the US.These days, it's hard to trust that the food you're eating was produced in a safe, humane and sustainable manner. We built the Eat Well Guide to make it easier to find good food and to support local farmers, restaurateurs and others who are doing their best by their customers, their workers and the planet. We personally vet every business that goes into the Guide, and we never charge or accept money in exchange for inclusion. The Guide's thousands of listings include restaurants, farms, farmers' markets, stores and more. Search by location and/or category, or check out our city guides to find tailored listings for restaurants and other sustainable vendors in cities across the US.",,"The Eat Well Guide® is a curated directory of over 25,000 hand-picked restaurants, farms, markets and other sources of local, sustainable food throughout the US."
Food Stand,prj30,Guides,Guides,,https://www.thefoodstand.com/,N/A,,,,,N,,"We have a vision: it’s of a world where good food is the default—not the exception. That’s why we set out on our mission — to build a more informed community around good food. That’s why we’re here: to connect a community of good eaters. Together, we can spread our knowledge about good eating and make the information more accessible to all. It starts by empowering the community to ask what’s on our plates. When we do that, we are all able to make healthier food choices—not only for ourselves, but for others. When we do this, in unison, that’s when we’ve made a food stand.",,We have a vision: it’s of a world where good food is the default—not the exception.
Local Harvest,prj29,Guides,Guides,,http://www.localharvest.org/new-york-ny,N/A,,,,,N,,"LocalHarvest connects people looking for good food with the farmers who produce it.Buying local is about enjoying real food, grown yourself or purchased from people you trust. It's about developing strong local economies and producing food on a human scale. It's about eating seasonally, practicing the art of cooking, and sitting down to enjoy meals together. It requires ample local and regional producers, processors, and distributors. As we see it, the goal of the local food movement is to create thriving community-based food systems that will make high quality local food available to everyone.To that end, LocalHarvest makes millions of introductions a year. Hear what some of our members have to say about us.We make it easy to find good food.",,LocalHarvest connects people looking for good food with the farmers who produce it.
MicroTextile Lab,prj28,Guides,Guides,,http://newyork.thecityatlas.org/lab/micro-textile-lab/,N/A,,,,,N,,"One mini-grant went to Laura Sansone, who has used it to make her Micro Textile Lab — an invention which she is now bringing to Greenmarkets around the city. Laura uses the Micro Textile Lab to teach people natural dyeing, spinning and weaving. You can follow Laura’s progress in the accompanying blog.",,"The Micro Textile Lab teaches people natural dyeing, spinning and weaving"
Community Gardens,prj54,N/A,N/A,,,N/A,,,,,N,,,,
Gowanus actions,prj57,N/A,N/A,,,N/A,,,,,N,,,,
Gray water projects,prj58,N/A,N/A,,,N/A,,,,,N,,,,
Rooftop Farms,prj55,N/A,N/A,,,N/A,,,,,N,,,,
Solar projects,prj59,N/A,N/A,,,N/A,,,,,N,,,,
Urban Farms,prj56,N/A,N/A,,,N/A,,,,,N,,,,
Chef Collaborative,prj32,Network,Network,,http://www.chefscollaborative.org/hello/,N/A,,,,,N,,"Join Chefs Collaborative, expand your network, and connect with hundreds of like-minded chefs and food professionals across the country who care about sourcing, cooking, and serving better food and are doing their part to create a better food system. Donate or become a Member today!MISSION: Chefs Collaborative is a national nonprofit network with a mission to inspire, educate, and celebrate chefs and food professionals building a better food system.",,"Join Chefs Collaborative, expand your network, and connect with hundreds of like-minded chefs and food professionals across the country who care about sourcing, cooking, and serving better food and are doing their part to create a better food system."
COMFOOD listserv,prj33,Network,Network,,https://elist.tufts.edu/wws/subscribe/comfood,N/A,,,,,N,,Comfood is an email discussion list on all aspects of community food systems and beyond.,,Comfood is an email discussion list on all aspects of community food systems and beyond.
Sea 2 Table,prj49,Network,Network,,http://www.sea2table.com/,N/A,,,,,N,,"Sea to Table partners with local fishermen from small-scale sustainable wild fisheries, finding better markets for their catch. Delivering overnight, direct from the source, reducing time and cost, allowing diners to know the ’who, how and where’ of the impossibly fresh fish they enjoy, creating a direct connection from fisherman to chef. #eatbetterfishIn 2012 we were proud to become a Certified B Corp.",,"Sea to Table partners with local fishermen from small-scale sustainable wild fisheries, finding better markets for their catch."
Bjorn Corn,prj37,Products,Products,,http://bjornqorn.com/,N/A,,,,,N,,"We use homegrown non-gmo popcorn and season with all natural, gluten free, and vegan ingredients. There is no butter or cheese! BjornQorn's special flavor comes from nutritional yeast, which is a high protein and high B-vitamin seasoning that is popular in vegan cuisine, but is especially great on popcorn.",,"We use homegrown non-gmo popcorn and season with all natural, gluten free, and vegan ingredients."
Botanical Colors,prj43,Products,Products,,http://botanicalcolors.com/,point,,,,,N,,"Botanical Colors supplies artisans and industry with the materials and know-how to dye textiles in a way that uses less water, is non-toxic and biodegradeable and draws its incomparable color palette from humble plants and natural sources. All colors are sustainably derived, many from agricultural and food waste products.We offer only the most robust dyes that perform on natural fibers with aplomb.",,"Botanical Colors supplies artisans and industry with the materials and know-how to dye textiles in a way that uses less water, is non-toxic and biodegradeable and draws its incomparable color palette from humble plants and natural sources."
Billion Oyster,prj41,Projects,Projects,,http://www.billionoysterproject.org/,point,Site,,40.6908199,-74.0226807,Y,"550 Short Ave, Brooklyn, NY 11231","BOP IS AN ECOSYSTEM RESTORATION AND EDUCATION PROJECT aimed at restoring one billion live oysters to New York Harbor and engaging hundreds of thousands of school children through restoration based STEM education programs. Students at New York Harbor School have been growing and restoring oysters in New York Harbor for the last six years. They have learned to SCUBA dive safely, raise oyster larvae, operate and maintain vessels, build and operate commercial-scaled oyster nurseries, design underwater monitoring equipment and conduct long-term authentic research projects all in the murky, contaminated, fast moving waters of one of the busiest ports in the country. Together and with the help of many partners these students have restored over eleven million oysters. Thirty-six public schools have partnered with the project to provide authentic, place-based science and math lessons through the lens of oyster restoration. Each year, thousands of students participate in these learning opportunities.",,"BOP is an ecosystem restoration and education project aimed at restoring one billion live oysters to New York Harbor and engaging hundreds of thousands of school children through restoration based STEM education programs."
Ellie Iron's weed gardens,prj63,Projects,Projects,,http://ellieirons.com/projects/sanctuary/,point,Gallery,,40.68755,-73.9625787,Y,,"Sanctuary for Weedy Species is a living collection of more than three hundred wild/invasive/exotic or otherwise uncultivated young plants transplanted from Bushwick’s urban soil to the Gallery at Industry City. At least forty species of plants hailing from various temperate and subtropical climates around the world live in the sanctuary. Some evolved right here in the New York City area, others originated in Central America, Northern Africa, or the mountains of Japan. Although they have diverse origins, all have made the city their home. They are well-adapted to living alongside humans, although we often tend to ignore, malign or even intentionally destroy them. In Bushwick, the open earth they occupy is rapidly receding as new parking lots, condominiums, and other development projects fill in the neighborhood’s remaining “vacant” spaces. This weedy sanctuary provides the opportunity to see these plants up close in an unusual context. I invite you to take a break from winter in the city. Come relocate and rehabilitate alongside the sanctuary inhabitants, and imagine for a moment a vision of urban ecology that takes what is, not what was, as its starting point.",,Sanctuary for Weedy Species is a living collection of more than three hundred wild/invasive/exotic or otherwise uncultivated young plants transplanted from Bushwick’s urban soil to the Gallery at Industry City.
"Guerrilla Cartography - an atlas of maps focused on different topics of relevance, including food",prj38,Projects,Projects,,http://www.guerrillacartography.org/,,,,,,N?,,"The mission of Guerrilla Cartography is to widely promote the cartographic arts and facilitate an expansion of the art, methods, and thematic scope of cartography, through collaborative projects, hosting theme-based community workshops and symposiums, and mounting public exhibitions. Founded on the idea that a new paradigm for cooperative and collaborative knowledge-caching and sharing could have a transformative effect on the awareness and dissemination of spatial information, Guerrilla Cartography formed in 2012 to create Food: An Atlas.The food atlas project was an experiment in guerrilla cartography and publishing. An open call for maps was shared and re-shared through a network of people who care about geography or food (or both) and the cartographers and researchers decided by their submissions what would be in the atlas.The atlas was published by a consortium of supporters using a crowd-funding platform—the people made the atlas, literally gave it form. The project garnered a lot of media attention—for its content and its methodology—and we continue to receive requests for content to mount public and web-based exhibits.As a registered California 501(c)(3) nonprofit, Guerrilla Cartography is committed to a free and open distribution of information. We sell volumes to support our organization but always allow free download of our content and pledge a share of our printed volumes to schools and libraries at no cost.Our experiment in guerrilla cartography created more than an atlas. With more than 120 collaborators from 15 countries, the first guerrilla cartography project created a community—one that continues to grow. Please go to our Call for Maps to see how you can contribute to Water: An Atlas.",,"The mission of Guerrilla Cartography is to widely promote the cartographic arts and facilitate an expansion of the art, methods, and thematic scope of cartography, through collaborative projects, hosting theme-based community workshops and symposiums, and mounting public exhibitions."
Swale,prj39,Projects,Projects,,http://www.swaleny.org/,point,Site,,40.689577,-74.023066,Y,,"Food forests are arguably the oldest form of gardening, generated through companion planting methods. But their importance is so much more than their history. Food forests are a way to diversify plant life through supportive planting; each plant building, supporting, and sustaining the next, each plant an important part of its created ecosystem. The system being built through food forests extends to our community as well. This form of gardening puts us back into direct contact with our needed resources, invites us to care for these resources that will in turn care for us, for our communities. Food forests are a naturally regenerating, resilient, and effective agro-ecosystems, which can, over time, provide free, fresh food. However, food forests on New York City's public land have been off-limits for almost a century for fear that a glut of foragers may destroy an ecosystem. But Swale imagines a different world, a different solution.By creating a floating food forest, we create a different set of rules.",Mary Mattingly,"By creating a floating food forest, we create a different set of rules."
The Cloud Machine,prj64,Projects,Projects,,http://www.amateurhuman.org/cloud-machine,point,N/A,,,,N?,,"Taking the atmosphere as its object of study, this project delves into an investigation of the present notions of nature intertwined with social and technological systems. It maps the layers and flows of the infosphere, tracing the immaterial work of social systems inscribing themselves into the materiality of the planet, and remaking it. It explores the notion of science as able to understand, predict, model and perhaps even control natural processes.The project is carried out by constructing and deploying devices and participatory practices that probe the knowledge, technology, ethics and ideologies of our culture. Public interventions demonstrate intricacy of interactions of social and natural systems and encourage public dialogue about atmospheric disruption. They range from organizing citizen observers to create a crowdsourced image of the sky that is equal and opposite to the image taken by a satellite at the same time, to founding a biotech startup which proposes the use of biosphere for data transfer and storage, to modifying the atmosphere one cloud at a time, to designing practices for employing body and senses in regulated athleticism which trains us for the impending transformation and the acute uncertainties associated with it.",,"Taking the atmosphere as its object of study, this project delves into an investigation of the present notions of nature intertwined with social and technological systems."
Tree of 40 Fruit - Sam Van Aken,prj40,Projects,Projects,,http://www.treeof40fruit.com/,points,Tree Locations,"[{""lat"": 41.2090834, ""lon"": -73.5822305}, {""lat"": 36.374084, ""lon"": -94.2099854}, {""lat"": 43.0391573, ""lon"": -76.1373045}, {""lat"": 42.325431, ""lon"": -71.2486973}, {""lat"": 40.7381657, ""lon"": -74.350146}, {""lat"": 38.1889917, ""lon"": -85.8168537}, {""lat"": 40.1037741, ""lon"": -75.4470717}, {""lat"": 41.2120214, ""lon"": -73.577188}, {""lat"": 44.5650678, ""lon"": -69.6628943}, {""lat"": 38.1889917, ""lon"": -85.8168537}, {""lat"": 44.8944168, ""lon"": -86.0024328}, {""lat"": 44.4560089, ""lon"": -68.4648353}]",,,Y,,"The Tree of 40 Fruit is an ongoing series of hybridized fruit trees by contemporary artist Sam Van Aken. Each unique Tree of 40 Fruit grows over forty different types of stone fruit including peaches, plums, apricots, nectarines, cherries, and almonds. Sculpted through the process of grafting, the Tree of 40 Fruit blossom in variegated tones of pink, crimson and white in spring, and in summer bear a multitude of fruit. Primarily composed of native and antique varieties the Tree of 40 Fruit are a form of conservsation, preserving heirloom stone fruit varieties that are not commercially produced or available.",,The Tree of 40 Fruit is an ongoing series of hybridized fruit trees by contemporary artist Sam Van Aken.
CUNY Food Policy Center,prj36,Research & Policy,Research & Policy,,http://www.nycfoodpolicy.org/,point,HQ,,40.7999544,-73.9414886,Y,"2180 Third Avenue Ste 525 New York, NY 10035","The New York City Food Policy Center develops intersectoral, innovative and evidence-based solutions to preventing diet-related diseases and promoting food security in New York and other cities. The Center works with policy makers, community organizations, advocates and the public to create healthier, more sustainable food environments and to use food to promote community and economic development. Through interdisciplinary research, policy analysis, evaluation and education, we leverage the expertise and passion of the students, faculty and staff of Hunter College and CUNY. The Center aims to make New York a model for smart, fair food policy.",,"The New York City Food Policy Center develops intersectoral, innovative and evidence-based solutions to preventing diet-related diseases and promoting food security in New York and other cities."
CUNY Urban Food Policy Institute,prj65,Research & Policy,Research & Policy,,cunyurbanfoodpolicy.org,point,HQ,,40.8074973,-73.9463391,Y,"55 WEST 125TH STREET, NEW YORK, NY, 10027","Academic research and action center at the CUNY Graduate School of Public Health and Health Policy located in Harlem, NYC. We provide evidence to inform municipal policies that promote equitable access to healthy, affordable food. We apply an intersectoral perspective that links nutrition and health to sustainable community and workforce development, and we engage partners from city government, community organizations, and the university in food policy research and action.",,"Academic research and action center at the CUNY Graduate School of Public Health and Health Policy located in Harlem, NYC."
