name,id,category,categoryDisplay,keywords,link,pointType,locationType,locations,latitude,longitude,mappable,address,description,notes,shortDesc
Civil Eats,prj2,Blogs/Articles,Blogs/Articles,,http://civileats.com/,N/A,,,,,N,,Civil Eats is a daily news source for critical thought about the American food system. We publish stories that shift the conversation around sustainable agriculture in an effort to build economically and socially just communities.,,Civil Eats is a daily news source for critical thought about the American food system.
Lucky Peach,prj1,Blogs/Articles,Blogs/Articles,,http://luckypeach.com/the-carbon-footprint-of-eating-out/?utm_content=buffer42a1a&utm_medium=social&utm_source=facebook.com&utm_campaign=buffer,N/A,,,,,N,,"Lucky Peach is a food and lifestyle journal that explores a monthly theme through essays, art, photography, recipes, and original video content.",,"Lucky Peach is a food and lifestyle journal that explores a monthly theme through essays, art, photography, recipes, and original video content."
Project Noah,prj53,Citizen Science,Citizen Science,,http://www.projectnoah.org/,N/A,,,,,N,,"Project Noah is an award-winning software platform designed to help people reconnect with the natural world. Launched out of NYU’s Interactive Telecommunications Program in early 2010, the project began as an experiment to mobilize citizen scientists and build a digital butterfly net for the 21st century. Backed by National Geographic, Project Noah is mobilizing a new generation of nature explorers and helping people from around the world appreciate their local wildlife. Our community is harnessing the power and popularity of new mobile technologies to collect important ecological data and help preserve global biodiversity.",,Project Noah is mobilizing a new generation of nature explorers and helping people from around the world appreciate their local wildlife.
Public Lab,prj3,Citizen Science,Citizen Science,,https://publiclab.org/,N/A,,,,,N,,"Public Lab is a community where you can learn how to investigate environmental concerns. Using inexpensive DIY techniques, we seek to change how people see the world in environmental, social, and political terms.",,"Public Lab is a community where you can learn how to investigate environmental concerns. Using inexpensive DIY techniques, we seek to change how people see the world in environmental, social, and political terms."
Added Value Farm,prj9,Community Activism,Community Activism,"education, farming, production, compost, farmer's market",http://www.added-value.org/,points,Farms,"[{""lat"": 40.6719774, ""lon"": -74.0111804}, {""lat"":40.6761638, ""lon"":-74.0133777}]",,,Y,,"Added Value Farms is a youth-led urban farming and compost operation in Red Hook, Brooklyn. We create opportunities for teens to expand their knowledge base, develop their leadership skills, and positively engage with each other, their community, and the environment. Since our founding in 2001, we have mentored scores of youth, provided hundreds of elementary students with educational programs, and worked with thousands of volunteers to farm and compost in the city. Together we strive to transform vacant lands into vibrant urban farms, improve access to healthy, affordable produce, and nurture a new generation of green leaders.",,"Added Value Farms is a youth-led urban farming and compost operation in Red Hook, Brooklyn."
BK Rot,prj10,Community Activism,Community Activism,"compost, food waste",https://bkrot.org/,point,HQ,,40.697844,-73.9281057,Y,,"BK ROT is a community-supported composting operation that generates year-round environmental jobs for local youth in Bushwick, Brooklyn. BK ROT youth earn stipends to collect organic waste from residents small businesses and community institutions by bike, and process the material at our two compost sites. Our primary mission is to work at the intersection of the social and environmental injustices impacting youth of color from the neighborhood and the health of our community and larger ecosystem. We believe the fight against the systems that generate environmental destruction and social inequality must be community-led, and must empower those most affected by these crises. We envision a city where the environmental progress made at the policy levels are inclusive of those most excluded from the current opportunities for meaningful environmental jobs. We see great potential for grassroots efforts at the neighborhood level to experiment with solutions climate change while creating genuine space and opportunity for youth to drive these efforts.",,"BK ROT is a community-supported composting operation that generates year-round environmental jobs for local youth in Bushwick, Brooklyn."
City Harvest,prj42,Community Activism,Community Activism,"food collection, food waste",https://www.cityharvest.org/,point,,,40.7465406,-73.987168,Y,6 EAST 32ND ST 5TH FLOOR NY NY 10016,"City Harvest pioneered food rescue in 1982 and, this year, will collect 55 million pounds of excess food to help feed the nearly 1.4 million New Yorkers struggling to put meals on their tables. Through relationships with farms, grocers, restaurants, and manufacturers, City Harvest collects nutritious food that would otherwise go to waste and delivers it free of charge to 500 soup kitchens, food pantries and other community food programs across the five boroughs. In addition to helping meet the immediate need for food, City Harvest developed long-term Healthy Neighborhoods programs which partner with low-income communities to increase access to fresh produce and help residents shop for and cook nutritious, budget-conscious meals.",,"City Harvest pioneered food rescue in 1982 and, this year, will collect 55 million pounds of excess food to help feed the nearly 1.4 million New Yorkers struggling to put meals on their tables,"
Citymeals-on-Wheels,prj5,Community Activism,Community Activism,food collection,http://www.citymeals.org/,point,HQ,,40.7501715,-73.9786714,Y,,"Citymeals on Wheels raises private funds to ensure no homebound elderly New Yorker will ever go a day without food or human company. Last year, our family of contributors helped us bring 2 million nutritious meals to more than 18,000 frail aged in every borough of New York City. In addition, nearly 19,000 volunteers collectively spent 67,397 hours visiting and delivering meals to our neighbors. Citymeals funds 31 community-based agencies that bring weekend, holiday and emergency meals to homebound elderly New Yorkers who can no longer shop or cook for themselves. In addition, our Mobile Food Pantry program delivers weekly bags of grocery staples to the most at-risk elderly and our Fresh Produce program enables us to supplement regular meal deliveries with fresh fruit and vegetables from local farmers.",,Citymeals on Wheels raises private funds to ensure no homebound elderly New Yorker will ever go a day without food or human company.
Food Bank for NYC,prj6,Community Activism,Community Activism,"food collection, food poverty",http://www.foodbanknyc.org/,point,HQ,,40.706348,-74.0156005,Y,,"Food Bank For New York City has been the city’s major hunger-relief organization working to end hunger throughout the five boroughs for more than 30 years. Nearly one in five New Yorkers relies on Food Bank for food and other resources. Food Bank takes a strategic, multifaceted approach that provides meals and builds capacity in the neediest communities, while raising awareness and engagement among all New Yorkers. Through its network of more than 1,000 charities and schools citywide, Food Bank provides food for approximately 64 million free meals per year for New Yorkers in need. Food Bank For New York City’s income support services, including food stamps (also known as SNAP) and free tax assistance for the working poor, put more than $150 million each year into the pockets of New Yorkers, helping them to afford food and achieve greater dignity and independence. In addition, Food Bank’s nutrition education programs and services empower more than 275,000 children, teens and adults to sustain a healthy diet on a low budget. Working toward long-term solutions to food poverty, Food Bank develops policy and conducts research to inform community and government efforts.",,Food Bank For New York City has been the city’s major hunger-relief organization working to end hunger throughout the five boroughs for more than 30 years.
FoodFight,prj35,Community Activism,Community Activism,"education, health",http://foodfight.org/,point,HQ,,40.7566898,-73.9822061,Y,,"FoodFight’s mission is to revolutionize the way we eat and think about food. Using schools as a platform, FoodFight arms teachers, students, parents and school staff with the tools and knowledge they need to make healthier choices and become role models and agents of change for their families and communities.",,"FoodFight’s mission is to revolutionize the way we eat and think about food. Using schools as a platform, FoodFight arms teachers, students, parents and school staff with the tools and knowledge they need to make healthier choices and become role models and agents of change for their families and communities."
Glynwood,prj51,Community Activism,Community Activism,"education, farming, local",https://glynwood.org/,point,Farm,,41.4536387,-73.8674944,Y,,"Glynwood is an agricultural nonprofit organization based in Cold Spring, New York. We work toward our mission of ensuring that the Hudson Valley is a region defined by food through core programming we develop and implement to further enhance the viability of sustainable farming.",,"Glynwood is an agricultural nonprofit organization based in Cold Spring, New York."
GrowNYC,prj47,Community Activism,Community Activism,"compost, community gardens, farmer's market, education",http://www.grownyc.org/,point,HQ,,40.710155,-74.0054233,Y,,"GrowNYC is the sustainability resource for New Yorkers: providing free tools and services anyone can use in order to improve our City and environment.Our mission is to improve New York City's quality of life through environmental programs that transform communities block by block and empower all New Yorkers to secure a clean and healthy environment for future generations.GrowNYC was originally created in 1970 as the Council on the Environment of New York City (CENYC). Born out of the spirit of the first Earth Day, CENYC was initially a policy-based organization, writing comprehensive reports about quality of life issues like air quality, traffic, and noise. Over the past 45 years we've become a service organization: whether it's operating the world famous Union Square Greenmarket, building a new community garden, teaching young people about the environment, or improving recycling awareness, if you're a New Yorker, GrowNYC is working near you!",,GrowNYC is the sustainability resource for New Yorkers: providing free tools and services anyone can use in order to improve our City and environment.
Just Food,prj8,Community Activism,Community Activism,"csa, urban ag, community gardens, local",http://www.justfood.org/,point,HQ,,40.7581234,-73.985218,Y,,"Just Food empowers and supports community leaders to advocate for and increase access to healthy, locally-grown food, especially in underserved NYC neighborhoods. We provide training and resources to community members so they can: Launch Projects like farmers’ markets and community supported agriculture (CSA) groups. Educate their neighbors in fundamental cooking and urban farming skills. Advocate to make their corner of NYC a healthier place to live and eat. Each year, nearly a quarter million New Yorkers access fresh food in their neighborhood through Just Food’s network of community food projects.",,"Just Food empowers and supports community leaders to advocate for and increase access to healthy, locally-grown food, especially in underserved NYC neighborhoods."
NESAWG,prj44,Community Activism,Community Activism,"agriculture, sustainability",http://nesawg.org/,point,,,41.0351023,-73.8655133,Y,"IRVINGTON, NY 10533","NESAWG, a project of the Tides Center, is a 12-state network of over 500 participating organizations. Together, we unite farm and food system practitioners and allies to build a sustainable, just and economically vibrant region.Our region includes Connecticut, Delaware, Massachusetts, Maine, Maryland, New Hampshire, New Jersey, New York, Pennsylvania, Rhode Island, Vermont, West Virginia, and Washington D.C.",,"NESAWG, a project of the Tides Center, is a 12-state network of over 500 participating organizations. Together, we unite farm and food system practitioners and allies to build a sustainable, just and economically vibrant region."
NOFA,prj45,Community Activism,Community Activism,"farming, advocacy, training",https://www.nofany.org/,point,HQ,,42.9641112,-77.3510816,Y,"1423 Hathaway Dr, Farmington, NY 14425","NOFA-NY is an organization of farmers, gardeners, and consumers working together to create a sustainable regional food system that's ecologically sound and economically viable. Through demonstration and education, we promote land stewardship, organic food production, and local marketing. We bring consumer and farmer together to make high quality food available to all people.",,"NOFA-NY is an organization of farmers, gardeners, and consumers working together to create a sustainable regional food system that's ecologically sound and economically viable."
Sustainable Restaurant Corps,prj48,Community Activism,Community Activism,"sustainability, training, restaurant",http://www.sustynyc.org/,point,HQ,,40.714171,-74.0182997,Y,,"The Sustainable Restaurant Corps (SRC) is a non-profit that helps restaurants in the 5 boroughs of NYC reduce their impact on the environment.We help restaurants lower their utility bills, reduce waste, serve more sustainable food, and more.We are developing a rating system that will help you find green restaurants on the web sites you visit most to decide where to eat.",,The Sustainable Restaurant Corps (SRC) is a non-profit that helps restaurants in the 5 boroughs of NYC reduce their impact on the environment.
The Brooklyn Food Coalition,prj4,Community Activism,Community Activism,sustainability,http://brooklynfoodcoalition.org/,point,HQ,,40.673388,-73.9701312,Y,,"The Brooklyn Food Coalition helps people with strategies, resources and practical solutions for building a healthy, resilient and sustainable life.",,"The Brooklyn Food Coalition helps people with strategies, resources and practical solutions for building a healthy, resilient and sustainable life."
Vallejo: City of Opportunity Lacks Access to Healthy Food,prj66,Community Activism,Community Activism,"research, health, food poverty",http://www.foodispower.org/wp-content/uploads/vallejoReport_high.pdf,point,City,,38.1168712,-122.4026746,Y,,"Founded in 2007, Food Empowerment Project (F.E.P.) seeks to create a more just and sustainable world by recognizing the power of one’s food choices. We encourage healthy food choices that reflect a more compassionate society by spotlighting the abuse of animals on farms, the depletion of natural resources, unfair working conditions for produce workers, and the unavailability of healthy foods in communities of color and low-income areas. F.E.P. is a national nonprofit located in Northern California. Our mission is to encourage people to make the most ethical choices when eating, which in the end is healthier for them and the planet and can help to improve the lives of others locally and globally. We are compelled to learn why eating healthy food in U.S. cities seems to be a privilege and not a right.",urban food activism | data/survey/mapping/GIS,Food Empowerment Project (F.E.P.) seeks to create a more just and sustainable world by recognizing the power of one’s food choices.
Cloud Institute for Sustainability Education,prj14,Education,Education,,http://cloudinstitute.org/,point,HQ,,40.7469286,-73.9952621,Y,,We prepare school systems and their communities to educate for a sustainable future by inspiring educators and engaging students through meaningful content and learner-centered instruction.,,We prepare school systems and their communities to educate for a sustainable future by inspiring educators and engaging students through meaningful content and learner-centered instruction.
Food Empowerment Project,prj67,Education,Education,,foodispower.org,point,HQ,,38.3292827,-122.7264224,Y,,"Food Empowerment Project seeks to create a more just and sustainable world by recognizing the power of one’s food choices. We encourage healthy food choices that reflect a more compassionate society by spotlighting the abuse of animals on farms, the depletion of natural resources, unfair working conditions for produce workers, and the unavailability of healthy foods in low-income areas.By making informed choices, we can prevent injustices against animals, people, and the environment. We also work to discourage negligent corporations from pushing unhealthy foods into low-income areas and empower people to make healthier choices by growing their own fruits and vegetables. In all of our work, Food Empowerment Project seeks specifically to empower those with the fewest resources.Food Empowerment Project is a vegan food justice organization and a registered non-profit 501(c)(3) and was founded in 2006 by lauren Ornelas. Learn more about the organization’s leadership team.",,Food Empowerment Project seeks to create a more just and sustainable world by recognizing the power of one’s food choices.
Green Bronx Machine,prj12,Education,Education,,http://greenbronxmachine.org/,points,Operating Locations,"[{""lat"":40.8156604,""lon"":-73.8874339}, {""lat"":40.8166803,""lon"":-73.8926417}, {""lat"":40.8360854,""lon"":-73.906974}, {""lat"":40.8505989,""lon"":-73.8791869}]",,,Y,,"Green Bronx Machine builds healthy, equitable, and resilient communities through inspired education, local food systems, and 21st Century workforce development. Dedicated to cultivating minds and harvesting hope, our school-based model using urban agriculture aligned to key school performance indicators grows healthy students and healthy schools to transform communities that are fragmented and marginalized into neighborhoods that are inclusive and thriving. We believe that healthy students help drive healthy schools, and that healthy schools are at the heart of healthy communities. We envision growing healthy communities where those who are “apart from” will become “part of” new solutions that benefit 100% of society; a world where people do not have to leave their community to live, learn and earn in a better one. Together, we can grow something greater! Ready, set, GROW!",,"Green Bronx Machine builds healthy, equitable, and resilient communities through inspired education, local food systems, and 21st Century workforce development."
Institute for Integrative Nutrition,prj20,Education,Education,,http://www.integrativenutrition.com/,point,HQ,,40.7444091,-73.9893442,Y,,"Our mission is to play a crucial role in improving health and happiness, and through that process, create a ripple effect that transforms the world. The Institute for Integrative Nutrition (IIN) was founded in 1992 by Joshua Rosenthal. Once a small classroom of passionate students in New York City, it is now the largest nutrition school in the world. Through its innovative online learning platform, Integrative Nutrition has provided a global learning experience for ~100,000 students and graduates in over 100 countries worldwide.",,"Our mission is to play a crucial role in improving health and happiness, and through that process, create a ripple effect that transforms the world."
Kids Food Festival,prj16,Education,Education,,http://kidsfoodfestival.com/,point,Event Location,,40.7536005,-73.9854213,Y,,"The Kids Food Festival is a weekend event focusing on educating families about making balanced food choices through fun and flavorful activities.The exciting and engaging programming of the Kids Food Festival helps to establish wholesome lifelong habits, while working to avert childhood obesity.",,The Kids Food Festival is a weekend event focusing on educating families about making balanced food choices through fun and flavorful activities.
MoFAD,prj31,Education,Education,,http://www.mofad.org/,point,Museum,,40.718848,-73.9517688,Y,,"The Museum of Food and Drink (MOFAD) is on a journey to create the world's first large-scale museum with exhibits you can eat.MOFAD seeks to advance public understanding of the culture, history, science, production, and commerce of food and drink. The museum currently operates MOFAD Lab, an exhibit design studio and gallery space in Brooklyn, NY, where Flavor: Making It and Faking It is now on show.Supported by a diverse community of donors, volunteers, and partners, MOFAD is working toward a global center for learning with multiple exhibition galleries, program and workshop space, a garden, café, and more. Join the effort by donating, joining, or volunteering.",,The Museum of Food and Drink (MOFAD) is on a journey to create the world's first large-scale museum with exhibits you can eat.
Natural Gourmet Institute,prj19,Education,Education,,https://naturalgourmetinstitute.com/,point,HQ,,40.7410509,-73.9951062,Y,,"Natural Gourmet Institute provides exceptional, innovative and interdisciplinary health-supportive culinary education. Rooted in Dr. Annemarie Colbin’s seven criteria for food selection, our curriculum empowers chefs, individuals and communities to be leaders in the conversation about food and wellbeing through the preparation of healthful and delicious meals. By making mindful and deliberate decisions about the ingredients we source, we are able to advocate and utilize a sustainable food system that respects the earth’s natural resources and the people who make each meal possible.",,"Natural Gourmet Institute provides exceptional, innovative and interdisciplinary health-supportive culinary education."
North American Food Systems Network,prj52,Education,Education,,http://foodsystemsnetwork.org/,point,HQ,,42.4534531,-76.4756914,Y,,"The North American Food Systems Network (NAFSN) is a new organization founded in 2015 offering leadership and technical skills training, networking, and other professional development opportunities for the burgeoning group of individuals supporting the development of equitable and sustainable local and regional food systems.Members range from farm educators and community nutritionists to activists and scholars. The mission of this community of practice is to coalesce the current disparate group of practitioners, and build individual and collective capacity to solve pressing food and agriculture issues on the continent. Presently there are many innovative solutions and pioneering organizations working to address and understand the complex issues of food systems_for example, working to eliminate causes of food deserts, obesity, hunger, and other food-related human health issues as well as working to increase sustainable farming practices, ecological and economic health of farms and rural areas, and creating viable markets.",,"The North American Food Systems Network (NAFSN) is a new organization founded in 2015 offering leadership and technical skills training, networking, and other professional development opportunities for the burgeoning group of individuals supporting the development of equitable and sustainable local and regional food systems."
Pure Food Kids Foundation,prj11,Education,Education,,http://www.purefoodkids.org/,point,HQ,,40.7388528,-73.9917005,Y,,OUR MISSION IS TO EMPOWER KIDS TO MAKE HEALTHY FOOD CHOICES FOR LIFE.,,OUR MISSION IS TO EMPOWER KIDS TO MAKE HEALTHY FOOD CHOICES FOR LIFE.
Stone Barns Center,prj17,Education,Education,,https://www.stonebarnscenter.org/,point,Farm,,41.103059,-73.8312807,Y,,"Stone Barns Center for Food and Agriculture is a nonprofit organization on a mission to create a healthy and sustainable food system.We are working to develop a culture of eating based on what farms need to grow to build healthy soil and a resilient ecosystem. In our quest to transform the way America eats and farms, we convene change makers, train farmers, educate food citizens and develop agroecological farming practices. We:Experiment with and improve sustainable farming practices.Train beginning farmers in resilient, regenerative farming techniques.Help children discover the sources of their food while preparing them to steward the land that provides it.Increase public awareness of healthy, seasonal and sustainable food.Our food system is on an unsustainable course: resource depletion, environmental degradation, epidemics of disease and obesity, food that doesn't represent the true costs of its production. We are working to change the way America eats and farms by inspiring people, engaging leaders and the public, developing practices in resilient agriculture and driving choices that benefit human health and the environment. Join us!",,Stone Barns Center for Food and Agriculture is a nonprofit organization on a mission to create a healthy and sustainable food system.
